{
  "version": "research-real-v1",
  "status": "curated-real-source-metadata",
  "annotationPolicy": "Gold answers are independently curated from the pinned paper version and, when present, the pinned repository revision. UNKNOWN means evidence is unavailable or temporal scope is unresolved. NOT_REPORTED is used only when the specified source scope was inspected and explicitly establishes absence. Conflicts preserve both credible source values.",
  "splitPolicy": {
    "development": "12 cases used for development and failure analysis.",
    "holdout": "6 paper-level cases frozen for one checkpoint evaluation after development stabilizes.",
    "holdoutInfluencedTuning": false
  },
  "cases": [
    {
      "caseId": "rp-transformer-1706",
      "split": "development",
      "title": "Attention Is All You Need",
      "authors": [
        "Ashish Vaswani",
        "Noam Shazeer",
        "Niki Parmar",
        "Jakob Uszkoreit",
        "Llion Jones",
        "Aidan N. Gomez",
        "Lukasz Kaiser",
        "Illia Polosukhin"
      ],
      "category": "architecture",
      "source": {
        "arxivId": "1706.03762",
        "arxivVersion": "v1",
        "absUrl": "https://arxiv.org/abs/1706.03762v1",
        "pdfUrl": "https://arxiv.org/pdf/1706.03762v1",
        "paperRevisionDate": "2017-06-12",
        "repositoryUrl": "https://github.com/harvardnlp/annotated-transformer",
        "repositoryCommitSha": "debc9fd747bb2123160a98046ad1c2d4da44a567",
        "repositoryCommitDate": null,
        "paperSha256": "0a9bff1be3575cf9fe26a4a3d3a9175bc791ecec90de8b9deba4cff75d2b9476",
        "paperSha256Status": "VERIFIED",
        "artifactPolicy": "cache_only_no_redistribution",
        "temporalAlignment": "UNKNOWN"
      },
      "tasks": [
        {
          "taskId": "real-transformer-optimizer",
          "query": "What optimizer was used to train the Transformer base model?",
          "expectedStatus": "SUPPORTED",
          "expectedAnswer": {
            "optimizer": "Adam"
          },
          "expectedSourceClass": [
            "paper"
          ],
          "expectedLocator": "section 5.3 Optimizer",
          "annotationRationale": "The pinned paper reports the optimizer in its training details."
        }
      ]
    },
    {
      "caseId": "rp-bert-1810",
      "split": "development",
      "title": "BERT: Pre-training of Deep Bidirectional Transformers for Language Understanding",
      "authors": [
        "Jacob Devlin",
        "Ming-Wei Chang",
        "Kenton Lee",
        "Kristina Toutanova"
      ],
      "category": "pretraining",
      "source": {
        "arxivId": "1810.04805",
        "arxivVersion": "v1",
        "absUrl": "https://arxiv.org/abs/1810.04805v1",
        "pdfUrl": "https://arxiv.org/pdf/1810.04805v1",
        "paperRevisionDate": "2018-10-11",
        "repositoryUrl": "https://github.com/google-research/bert",
        "repositoryCommitSha": "eedf5716ce1268e56f0a50264a88cafad334ac61",
        "repositoryCommitDate": null,
        "paperSha256": "58534a3c000cbcc60ed64e999a2d9ed839edc2d9894e4449e9d79e1118b5e5ba",
        "paperSha256Status": "VERIFIED",
        "artifactPolicy": "cache_only_no_redistribution",
        "temporalAlignment": "UNKNOWN"
      },
      "tasks": [
        {
          "taskId": "real-bert-objective",
          "query": "Which two self-supervised objectives were used during BERT pre-training?",
          "expectedStatus": "SUPPORTED",
          "expectedAnswer": {
            "objectives": [
              "masked language model",
              "next sentence prediction"
            ]
          },
          "expectedSourceClass": [
            "paper"
          ],
          "expectedLocator": "section 3.1 Pre-training BERT",
          "annotationRationale": "The paper explicitly names both pre-training tasks."
        }
      ]
    },
    {
      "caseId": "rp-t5-1910",
      "split": "development",
      "title": "Exploring the Limits of Transfer Learning with a Unified Text-to-Text Transformer",
      "authors": [
        "Colin Raffel",
        "Noam Shazeer",
        "Adam Roberts",
        "Katherine Lee",
        "Sharan Narang",
        "Michael Matena",
        "Yanqi Zhou",
        "Wei Li",
        "Peter J. Liu"
      ],
      "category": "pretraining",
      "source": {
        "arxivId": "1910.10683",
        "arxivVersion": "v1",
        "absUrl": "https://arxiv.org/abs/1910.10683v1",
        "pdfUrl": "https://arxiv.org/pdf/1910.10683v1",
        "paperRevisionDate": "2019-10-24",
        "repositoryUrl": "https://github.com/google-research/text-to-text-transfer-transformer",
        "repositoryCommitSha": "6819e989bb733171706b9228d05468a4230e14c0",
        "repositoryCommitDate": null,
        "paperSha256": "b41ee513826361ff4d6076ded32e35fa6bc9dea19f6ba2b98feeb1a65c778483",
        "paperSha256Status": "VERIFIED",
        "artifactPolicy": "cache_only_no_redistribution",
        "temporalAlignment": "UNKNOWN"
      },
      "tasks": [
        {
          "taskId": "real-t5-format",
          "query": "How does T5 frame different NLP tasks?",
          "expectedStatus": "SUPPORTED",
          "expectedAnswer": {
            "formulation": "text-to-text"
          },
          "expectedSourceClass": [
            "paper"
          ],
          "expectedLocator": "section 2.1 Text-to-Text Framework",
          "annotationRationale": "The central task formulation is explicitly defined by the paper."
        }
      ]
    },
    {
      "caseId": "rp-megatron-1909",
      "split": "development",
      "title": "Megatron-LM: Training Multi-Billion Parameter Language Models Using Model Parallelism",
      "authors": [
        "Mohammad Shoeybi",
        "Mostofa Patwary",
        " Raul Puri",
        "Patrick LeGresley",
        "Jared Casper",
        "Bryan Catanzaro"
      ],
      "category": "systems",
      "source": {
        "arxivId": "1909.08053",
        "arxivVersion": "v1",
        "absUrl": "https://arxiv.org/abs/1909.08053v1",
        "pdfUrl": "https://arxiv.org/pdf/1909.08053v1",
        "paperRevisionDate": "2019-09-17",
        "repositoryUrl": "https://github.com/NVIDIA/Megatron-LM",
        "repositoryCommitSha": "91149c04c9aed830353be7795ec7d58461b8828a",
        "repositoryCommitDate": null,
        "paperSha256": "014b8a8d3cec8bee5e371b23e4f49d4e74597641febc36992faf33d8834f8fe2",
        "paperSha256Status": "VERIFIED",
        "artifactPolicy": "cache_only_no_redistribution",
        "temporalAlignment": "UNKNOWN"
      },
      "tasks": [
        {
          "taskId": "real-megatron-parallel",
          "query": "Which parallelism dimension is central to Megatron-LM's model-parallel approach?",
          "expectedStatus": "SUPPORTED",
          "expectedAnswer": {
            "parallelism": "tensor model parallelism"
          },
          "expectedSourceClass": [
            "paper"
          ],
          "expectedLocator": "section 2.2 Intra-layer Model Parallelism",
          "annotationRationale": "The method section explicitly describes the parallelism mechanism."
        }
      ]
    },
    {
      "caseId": "rp-zero-1910",
      "split": "development",
      "title": "ZeRO: Memory Optimizations Toward Training Trillion Parameter Models",
      "authors": [
        "Samyam Rajbhandari",
        "Jeff Rasley",
        "Olatz Cecilia",
        "Yuxiong He"
      ],
      "category": "distributed_training",
      "source": {
        "arxivId": "1910.02054",
        "arxivVersion": "v1",
        "absUrl": "https://arxiv.org/abs/1910.02054v1",
        "pdfUrl": "https://arxiv.org/pdf/1910.02054v1",
        "paperRevisionDate": "2019-10-04",
        "repositoryUrl": "https://github.com/microsoft/DeepSpeed",
        "repositoryCommitSha": "05daf0598b1657da832288f5e89d9e22a9a92ee5",
        "repositoryCommitDate": null,
        "paperSha256": null,
        "paperSha256Status": "PENDING_ACQUISITION",
        "artifactPolicy": "cache_only_no_redistribution",
        "temporalAlignment": "UNKNOWN"
      },
      "tasks": [
        {
          "taskId": "real-zero-stages",
          "query": "What does ZeRO partition across data-parallel processes?",
          "expectedStatus": "SUPPORTED",
          "expectedAnswer": {
            "partitioned_state": "optimizer states, gradients, and parameters"
          },
          "expectedSourceClass": [
            "paper"
          ],
          "expectedLocator": "section 2 ZeRO Overview",
          "annotationRationale": "The paper states the partitioned training-state components."
        }
      ]
    },
    {
      "caseId": "rp-scaling-laws-2001",
      "split": "development",
      "title": "Scaling Laws for Neural Language Models",
      "authors": [
        "Jared Kaplan",
        "Sam McCandlish",
        "Tom Henighan",
        "Tom B. Brown",
        "Benjamin Chess",
        "Rewon Child",
        "Scott Gray",
        "Alec Radford",
        "Jeffrey Wu",
        "Dario Amodei"
      ],
      "category": "scaling",
      "source": {
        "arxivId": "2001.08361",
        "arxivVersion": "v1",
        "absUrl": "https://arxiv.org/abs/2001.08361v1",
        "pdfUrl": "https://arxiv.org/pdf/2001.08361v1",
        "paperRevisionDate": "2020-01-23",
        "repositoryUrl": null,
        "repositoryCommitSha": null,
        "repositoryCommitDate": null,
        "paperSha256": "a41bd7877fd1a6bcbba096b2619618bd2f90e02488f2365644903eb2f7c6a494",
        "paperSha256Status": "VERIFIED",
        "artifactPolicy": "cache_only_no_redistribution",
        "temporalAlignment": "UNKNOWN"
      },
      "tasks": [
        {
          "taskId": "real-scaling-gpu-count",
          "query": "What GPU count did the paper report for every experiment?",
          "expectedStatus": "NOT_REPORTED",
          "expectedAnswer": {
            "gpu_count": null
          },
          "expectedSourceClass": [
            "paper_review"
          ],